{
  "schemaVersion": "supplement-1.0",
  "subfaction": "sautekh",
  "commonWargear": [
    {
      "id": "staff-of-the-destroyer",
      "name": "Staff of the Destroyer",
      "profiles": [
        {
          "label": "Shooting",
          "maxRange": 18,
          "strength": "6",
          "ap": "2+",
          "rules": "Assault 3, Gauss"
        },
        {
          "label": "Melee",
          "strength": "User",
          "ap": "3+"
        }
      ]
    },
    {
      "id": "storm-claw",
      "name": "Storm Claw",
      "profiles": [
        {
          "strength": "X2",
          "ap": "2+",
          "rules": "Slow, Monsterbane"
        }
      ]
    }
  ],
  "units": [
    {
      "id": "imotekh-the-stormlord",
      "name": "Imotekh the Stormlord",
      "slot": "HQ",
      "isUnique": true,
      "basePts": 350,
      "inlineRules": [
        {
          "id": "imotekh-improved-living-metal",
          "name": "Improved Living Metal",
          "fullDesc": "This model Heals +1 Wound in your Command Phase. This overrides the base Living Metal Rule."
        },
        {
          "id": "imotekh-mwbd",
          "name": "My Will Be Done",
          "fullDesc": "6\" Aura, this model and target unit may reroll 1's To Hit."
        },
        {
          "id": "imotekh-rm",
          "name": "Relentless March",
          "fullDesc": "6\" Aura, this model and target unit gain M+2."
        },
        {
          "id": "imotekh-bloodswarm-nanoscarabs",
          "name": "Bloodswarm Nanoscarabs",
          "fullDesc": "6\" Aura, target unit does not scatter when Deepstriking. Use on the first model before the scatter takes place."
        },
        {
          "id": "imotekh-tactical-genius",
          "name": "Tactical Genius",
          "fullDesc": "During Deployment, target unit gains Scout."
        },
        {
          "id": "imotekh-the-storm",
          "name": "The Storm",
          "fullDesc": "In your Command Phase, you may use The Storm. Until your next Command Phase, Night Fighting Rules are in effect. One Use Only."
        }
      ],
      "models": [
        {
          "id": "imotekh",
          "name": "Imotekh the Stormlord",
          "minCount": 1,
          "maxCount": 1,
          "statline": {
            "type": "infantry",
            "M": 4,
            "WS": 2,
            "BS": 5,
            "S": 5,
            "T": 5,
            "W": 7,
            "I": 2,
            "A": 5,
            "Ld": 10,
            "Sv": 3
          },
          "baseWargear": [
            "staff-of-the-destroyer",
            "storm-claw",
            "gauntlet-of-fire",
            "phase-shifter"
          ],
          "specialRules": [
            "independent-character",
            "living-metal",
            "reanimation",
            "fearless",
            "soulless-machine",
            "imotekh-improved-living-metal",
            "imotekh-mwbd",
            "imotekh-rm",
            "imotekh-bloodswarm-nanoscarabs",
            "imotekh-tactical-genius",
            "imotekh-the-storm"
          ]
        }
      ]
    }
  ]
}
